{
  "name": "ComplexCard",
  "description": "ComplexCard component",
  "category": "layout",
  "props": {},
  "variants": {},
  "composition": {
    "slots": [],
    "subComponents": []
  },
  "examples": [],
  "extensions": {
    "filePath": "tests/unit/fixtures/complex-card.js",
    "componentType": "arrow",
    "adaptor": "react-tsx",
    "extractedAt": "2025-07-26T04:21:42.197Z"
  }
}